{
  "schema_version": 1,
  "actor_kind": "deployment_admin",
  "resource": {
    "kind": "environment_policy",
    "site_id": "site_playground",
    "environment": "production"
  },
  "version": 3,
  "operation": "updated",
  "changed_fields": ["environment.allowed_origins"],
  "created_at": "2026-09-24T12:00:00Z",
  "expires_at": "2027-09-24T12:00:00Z"
}
